{
  "name": "Multi-Source Benchmark (4 sources)",
  "description": "Benchmark with 4 parallel sources",
  "version": "1.0.0",
  "sources": [
    {
      "name": "source-1",
      "source": "medium.txt",
      "type": "adblock"
    },
    {
      "name": "source-2",
      "source": "medium.txt",
      "type": "adblock"
    },
    {
      "name": "source-3",
      "source": "medium.txt",
      "type": "adblock"
    },
    {
      "name": "source-4",
      "source": "medium.txt",
      "type": "adblock"
    }
  ],
  "transformations": [
    "Deduplicate",
    "RemoveEmptyLines"
  ]
}